{
  "gate_id": "gate_contract_run_req_contract_001_step_002",
  "run_id": "contract_run_req_contract_001",
  "step_id": "step_002",
  "status": "waiting_review",
  "reason_code": "HUMAN_GATE_REQUIRED",
  "prompt": "Approve sending the owner report?",
  "requested_operation_id": "op_send_report",
  "created_at": "2026-05-23T08:31:00Z",
  "resolved_at": null,
  "decision": null,
  "decided_by": null
}
